id,text,label,normalized_text,meta_doc_drugs,final_pred
1ba86e33-e8b7-4bde-a23c-56cfe7f6bb4a,"Moreover, this case illustrates the usefulness of laser capture microdissection to obtain purified cell populations for molecular studies in lymphomas with relative paucity of tumor cells, as well as the need to analyze different IgH gene regions to decrease the rate of false-negative results in PCR clonality studies.",0,"Moreover, this case illustrates the usefulness of laser capture microdissection to obtain purified cell populations for molecular studies in lymphomas with relative paucity of tumor cells, as well as the need to analyze different IgH gene regions to decrease the rate of false-negative results in PCR clonality studies.",this drug,0
4860e725-33b9-41a8-8a3e-88c8977ee2a8,Four cases suggesting that a reduction in the daily dose or withdrawal of an antidepressant may produce symptoms of major depression within hours to days are presented.,0,Four cases suggesting that a reduction in the daily dose or withdrawal of an antidepressant may produce symptoms of major depression within hours to days are presented.,this drug,0
8962a7ee-4322-46e0-a4b4-e7144af371ed,Clinicians should be aware of this potential life-threatening adverse reaction and monitor kidney function while patients are using linezolid.,0,Clinicians should be aware of this potential life-threatening adverse reaction and monitor renal function while patients are using linezolid.,this drug,0
dcefe410-4d7b-461e-b8df-3cacc2f730a5,A 49-year-old man with Crohn's disease treated with prednisone and mesalamine (5-ASA) developed worsening respiratory distress and fever.,1,A 49-year-old male patient with Crohn's disease treated with prednisone and sulfasalazine (5-aminosalicylic acid) developed worsening respiratory insufficiency and pyrexia.,this drug,0
e24fa4c5-4e08-4931-a909-45747e2078b6,It is of interest that all of his teeth were extremely large and subsequently showed severe crowding in the dental arches.,0,It is of interest that all of his teeth were extremely large and subsequently showed severe malocclusion in the dental arches.,this drug,0
e25510e1-e18d-42d0-a5ea-b025b2c83d30,Anti-hypertensive therapy with propranolol during pregnancy and lactation.,0,Anti-hypertensive therapy with propranolol during pregnancy and lactation.,this drug,0
6d8f09d6-66de-4270-bcbe-895da7ef533b,A case is described in which viscoelastic material was used in the anterior chamber to minimize or prevent fluid flow through the area of the trabecular meshwork and Schlemm's canal during nonpenetrating filtering surgery.,0,A case is described in which viscoelastic material was used in the anterior chamber to minimize or prevent fluid flow through the area of the trabecular meshwork and Schlemm's canal during non-penetrating filtering surgery.,this drug,0
6dd41c84-6dae-4953-bf82-9d5b03870ace,"CONCLUSION: The new quinolone derivatives (levofloxacin, sparfloxacin, grepafloxacin, trovafloxacin, gatifloxacin and moxifloxacin), also called gyrase inhibitors, are known for their potential to cause central nervous system-related adverse effects, including headache, dizziness and insomnia.",1,"CONCLUSION: The new quinolone derivatives (levofloxacin, sparfloxacin, grepafloxacin, trovafloxacin, gatifloxacin and moxifloxacin), also called gyrase inhibitors, are known for their potential to cause central nervous system-related adverse effects, including headache, dizziness and insomnia.",this drug,1
e58cf838-c854-4ed2-8c23-a22f4f249b8c,"In contrast, our observation suggests that these substances may also display unexpected proconvulsant effects in vivo.",0,"In contrast, our observation suggests that these substances may also display unexpected proconvulsant effects in vivo.",this drug,0
4a507717-1eaf-444f-a9bd-47ce89497656,"Lithium carbonate did not prevent the tricyclic-induced rapid cycling, although two patients subsequently responded well to lithium carbonate alone.",0,"Lithium carbonate did not prevent the tricyclic-induced rapid cycling, although two patients subsequently responded well to lithium carbonate alone.",this drug,0
f74da875-9361-4595-adca-8f4704cfb85e,"Initially, National Institutes of Health Stroke Scale score was 21, and 24 hours later it improved to 9.",0,"Initially, National Institutes of Health Stroke Scale score was 21, and 24 hours later it improved to 9.",this drug,0
431fdf7f-6038-449d-8ce3-f5c88dc5234b,"The patient was found comatose and experienced repeated generalized tonic-clonic seizures, aspiration with subsequent pneumonia, hypotension, and an increase in PR interval.",0,"The patient was found comatose and experienced repeated generalized tonic-clonic seizures, aspiration with subsequent pneumonia, hypotension, and an increase in PR interval.",this drug,1
55a94fab-1659-4101-8565-dac6d524a9bc,Toxic hepatitis due to combination therapy with methotrexate and etretinate in psoriasis.,1,Toxic hepatitis due to combination therapy with methotrexate and etretinate in psoriasis.,this drug,0
ae3c1dde-6bdd-4070-bfb9-bacc7a422b24,Management of liver failure in a haemophilic patient co-infected with human immunodeficiency and hepatitis C viruses.,0,Management of liver failure in a hemophilic patient co-infected with human immunodeficiency virus and hepatitis C virus.,this drug,0
bbb1e8b3-4b59-4520-b08f-7ec013b743da,Marked hyperkalemia was observed during and immediately after an infusion of arginine monohydrochloride in two patients with severe hepatic disease and moderate renal insufficiency.,1,Marked hyperkalemia was observed during and immediately after an infusion of arginine monohydrochloride in two patients with severe hepatic disease and moderate renal insufficiency.,this drug,1
2f492e51-1a09-442c-8ab1-2889fbe3eef1,A patient experienced methadone withdrawal symptoms when combining these agents.,0,A patient experienced methadone withdrawal symptoms when combining these agents.,this drug,1
59c106a6-9a3b-4a4d-ab7a-9f65ae885794,"Three days after receiving intravitreal injection of bevacizumab (1.25 mg in 0.1 ml), he developed acute vision loss and change of consciousness.",1,"Three days after receiving intravitreal injection of bevacizumab (1.25 mg in 0.1 ml), he developed acute visual impairment and alteration of consciousness.",this drug,1
8aa9c2c6-e554-4a4b-aebb-44be41f824d8,"Common adverse events (frequency 10%) of lacosamide doses up to 600 mg/day include nonspecific central nervous system effects (e.g., dizziness, ataxia, diplopia, and somnolence).",1,"Common adverse events (frequency 10%) of lacosamide doses up to 600 mg/day include nonspecific central nervous system effects (e.g., dizziness, ataxia, diplopia, and somnolence).",this drug,1
0d9fcba2-fe68-4230-bcc1-a2c39291a516,"As of December 1998, only mild ectropion persisted.",0,"As of December 1998, only mild ectropion persisted.",this drug,1
915e151f-92ea-49a5-a347-7d284b797e48,Anterior chamber shallowing was noted in both patients at presentation.,0,Anterior chamber shallowing was noted in both patients at presentation.,this drug,1
11b7ebe6-beba-4fa4-bef5-009f3436b942,Tenofovir-associated nephrotoxicity in two HIV-infected adolescent males.,1,Tenofovir-associated nephrotoxicity in two HIV-infected adolescent males.,this drug,1
4491bb8a-e849-4ef6-9de6-21e1e5873a6e,"Radiotherapy is the mainstay of treatment for early nasopharyngeal cancer, but combination chemoradiotherapy is becoming more common for patients with advanced disease since the Intergroup trial 0099 demonstrated improved progression-free survival and overall survival for chemoradiotherapy.",0,"Radiotherapy is the mainstay of treatment for early nasopharyngeal cancer, but combination chemoradiotherapy is becoming more common for patients with advanced disease since the Intergroup trial 0099 demonstrated improved progression-free survival and overall survival for chemoradiotherapy.",this drug,0
b6f4820b-2777-4156-ac74-0e88516a3713,"Erection subsided spontaneously after 4 hours, with subsequent potency unimpaired.",0,"Erection subsided spontaneously after 4 hours, with subsequent potency unimpaired.",this drug,1
5226edde-7ada-4a6c-a18a-16645e5e821c,"Mianserin 30 mg/day, etizolam 1 mg/day and flunitrazepam 1 mg/day were administered.",0,"Mianserin 30 mg/day, etizolam 1 mg/day, and flunitrazepam 1 mg/day were administered.",this drug,0
446cfd4d-b18d-40ab-bb49-ce50827ee8e6,Prompt recognition of this syndrome and temporary cessation of CyA therapy may favorable affect the course.,0,Prompt recognition of this syndrome and temporary cessation of Cyclosporine therapy may favorably affect the course.,this drug,0
10711c3a-af08-4095-9ae2-c334ac769d91,"In case of normal endometrial cells in the Pap smear, a careful evaluation should be performed.",0,"In case of normal endometrial cells in the Pap smear, a careful evaluation should be performed.",this drug,0
2103eb0a-e5b3-416f-bb1b-862af37f31da,Thalidomide was withdrawn from world markets in 1961 following recognition of its teratogenic effects.,1,Thalidomide was withdrawn from world markets in 1961 following recognition of its teratogenic effects.,this drug,1
e191922a-773c-48eb-baa0-0f968c4a70f1,Intravenous cimetidine administered q8h offers a safe and cost-effective approach to H2-receptor blockade and reduction of gastric acid secretion in patients who are temporarily unable to take oral medication.,0,Intravenous cimetidine administered every 8 hours offers a safe and cost-effective approach to H2-receptor blockade and reduction of gastric acid secretion in patients who are temporarily unable to take oral medication.,this drug,0
0e1615ac-9b90-4f3f-b8f4-29c524a543b9,Clostridial orthopedic infections: case reports and review of the literature.,0,Clostridial orthopedic infections: case reports and review of the literature.,this drug,0
7cba5677-57e7-415a-b1e6-182163ba3b5d,A noninvasive method in the differential diagnosis of vecuronium-induced and magnesium-induced protracted neuromuscular block in a severely preeclamptic patient.,1,A noninvasive method in the differential diagnosis of vecuronium-induced and magnesium-induced prolonged neuromuscular blockade in a severely hypertensive patient.,this drug,0
d71ca4e9-6296-42ea-aee7-7f87ac113979,Topical capsaicin cream has been a beneficial adjuvant medication in the treatment of some painful conditions.,0,Topical capsaicin cream has been a beneficial adjuvant medication in the treatment of some painful conditions.,this drug,0
08af9fb5-629c-469b-b14f-b369a3a573a6,"Since its FDA approval in 2002, there are no known citations of ezetimibe-induced pancreatitis.",1,"Since its FDA approval in 2002, there are no known citations of ezetimibe-induced pancreatitis.",this drug,0
a2b74b41-0d28-41b9-9da3-ac5749fdce45,Recurrent septicemia with lethal outcome during and after cyclosporine therapy in severe ulcerative colitis.,1,Recurrent bacteremia with lethal outcome during and after cyclosporine therapy in severe ulcerative colitis.,this drug,1
ffce064e-4128-4ee0-9bc4-3d2114addeb6,Danazol induced thrombocytopenia.,1,Danazol-induced thrombocytopenia.,this drug,0
f963edd0-a154-47ca-9de5-e042761cb4f3,Long-term neuroleptic therapy in chronic anorexia nervosa complicated by tardive dyskinesia.,0,Long-term neuroleptic therapy in chronic anorexia nervosa complicated by tardive dyskinesia.,this drug,1
3e7e0051-efc8-4b40-884c-d570c9fd3f04,Prosthetic valve endocarditis caused by metallo-beta-lactamase-producing Pseudomonas aeruginosa.,0,Prosthetic valve endocarditis caused by metallo-beta-lactamase-producing Pseudomonas aeruginosa.,this drug,0
9d694d74-2983-4602-99e8-25759333fcf2,"We emphasise the need to be vigilant for this important but relatively rare complication, which has significant associated morbidity.",0,"We emphasize the need to be vigilant for this important but relatively rare complication, which has significant associated morbidity.",this drug,0
f2f6c3ac-8a85-4f94-a4e6-1f5e69dab31e,RESULTS: Nine children presented with clinically significant lead poisoning.,0,RESULTS: Nine children presented with clinically significant lead intoxication.,this drug,0
21dbc658-503e-4cca-96d8-6b7b19fdf090,We have cared for three children in whom four episodes of dystonia proceeding to opisthotonus occurred in association with carbamazepine use.,1,We have cared for three children in whom four episodes of dystonia proceeding to opisthotonus occurred in association with carbamazepine use.,this drug,1
1dbef842-945d-4b74-b451-45ba7c58fd20,"Twenty-one days after starting antiretroviral treatment, he became increasingly manic.",0,"Twenty-one days after starting antiretroviral therapy, he became increasingly manic.",this drug,1
261e3bca-8947-44a0-97e6-79a0ddaf515c,Twenty-seven consecutive patients admitted for an acute CAD were investigated using a standardized imaging protocol.,0,Twenty-seven consecutive patients admitted for an acute Coronary Artery Disease were investigated using a standardized imaging protocol.,this drug,0
ea8b8aec-e105-4d43-a585-4b07bf653710,"According to the Naranjo adverse drug reaction probability scale, the development of KS in this case was probably associated with the imatinib treatment (score, 5-8).",0,"According to the Naranjo adverse drug reaction probability scale, the development of Kaposi's sarcoma in this case was probably associated with the imatinib treatment (score, 5-8).",this drug,1
4073e915-6386-476a-bbd7-9be677d2446c,The interval between initiating treatment with interferon alfa and onset of anterior ischemic optic neuropathy was similar to that of interferon-associated vascular retinopathy.,1,The interval between initiating treatment with Angiotensin Converting Enzyme inhibitors and onset of anterior ischemic optic neuropathy was similar to that of Angiotensin Converting Enzyme inhibitors-associated vascular retinopathy.,this drug,1
ef051eb7-054a-4d68-9672-d2d3dfac6878,"The chemotherapy regimen consisted of cis-platinum, etoposide, actinomycin-D, and intrathecal methotrexate (PEA-M).",0,"The chemotherapy regimen consisted of cis-platinum, etoposide, actinomycin-D, and intrathecal methotrexate (PEA-M).",this drug,0
8fb32fb5-a74f-4ad7-ac7a-55b886856791,There may be an interval of one or more months after discontinuation of cyclophosphamide therapy before clinical or radiological improvement occurs.,0,There may be an interval of one or more months after discontinuation of cyclophosphamide therapy before clinical or radiological improvement occurs.,this drug,0
00b4b403-3963-4b44-82e5-f31a53a84c1e,Clofazimine induced nail changes.,1,Clofazimine-induced nail changes.,this drug,1
c5a7fcf7-bf68-4716-ae83-a97cbc0dfe8d,"Second malignancy is one of the late complications of long-term cancer survivors, treated with radiation or chemotherapy.",0,"Second malignancy is one of the late complications of long-term cancer survivors, treated with radiation or chemotherapy.",this drug,0
6f705ab4-8ca1-4e4c-bd39-ce0754a6f3c2,"When glucocorticoids are used for longer than brief periods, even in moderate dosages, they can produce a variety of adverse effects, including steroid diabetes.",0,"When glucocorticoids are used for longer than brief periods, even in moderate dosages, they can produce a variety of adverse effects, including steroid diabetes.",this drug,0
9ace27df-db4e-4aa3-a915-aaf33eff1f8a,"Extrapyramidal side effects induced by some selective serotonin reuptake inhibitors (SSRIs), i.e. fluoxetine and sertraline, have been previously reported in patients with depression and obsessive-compulsive disorder (OCD).",1,"Extrapyramidal side effects induced by some selective serotonin reuptake inhibitors (SSRIs), i.e. fluoxetine and sertraline, have been previously reported in patients with depression and obsessive-compulsive disorder (OCD).",this drug,0
d5890e07-2238-433b-a66d-62ff064dbd17,Mucosal pigmentation after oral lichen planus treatment with topical tacrolimus.,1,Mucosal pigmentation after oral lichen planus treatment with topical tacrolimus.,this drug,1
9ad384bd-102b-4364-ab3e-cc5c6b67ca3c,"With the use of optical coherence tomography (OCT), two patients with IFN-associated retinopathy who had developed macular edema and reduced visual acuity during the clinical course of IFN therapy were observed.",1,"With the use of optical coherence tomography (OCT), two patients with interferon-associated retinopathy who had developed macular oedema and reduced visual acuity during the clinical course of interferon therapy were observed.",this drug,1
9af113a4-6c77-4ab1-9408-5de4a2f44d37,Evans syndrome refers to a hematological autoimmune disorder with autoimmune hemolytic anemia accompanied by immune thrombocytopenia.,0,Evans syndrome refers to a hematological autoimmune disorder with autoimmune hemolytic anemia accompanied by immune thrombocytopenia.,this drug,0
1fd6455a-a9af-41a7-9bc8-42e6e6208f73,"We present a 20-year-old woman with Basedow-Graves' disease who developed PTU-induced fulminant hepatitis, which progressed to acute hepatic failure with grade III hepatic encephalopathy.",1,"We present a 20-year-old woman with Graves' disease who developed propylthiouracil-induced fulminant hepatitis, which progressed to acute hepatic failure with grade III hepatic encephalopathy.",this drug,0
36bb30fe-cb9d-4cc5-8183-e99fee6b722f,The bleeding resolved on discontinuation of APV.,1,The bleeding resolved on discontinuation of Abacavir.,this drug,1
2f552ded-63b1-4068-9344-8d40908cf658,Detailed investigations first revealed a low renin level without hypokalemia.,0,Detailed investigations first revealed a low renin level without hypokalemia.,this drug,1
bbb54531-d8f6-4d6d-addc-8d35005a455f,Pediatric neurosurgeons commonly instill vancomycin into the ventricles to treat shunt infections.,0,Pediatric neurosurgeons commonly instill vancomycin into the ventricles to treat shunt infections.,this drug,0
0f9db0dd-2264-4066-b8a2-17ad48a012be,Serum potassium values higher than 7 mmol x l-1 are associated with cardiac arrhythmias and an increased incidence of intraventricular haemorrhage and periventricular leucomalacia.,0,Serum potassium values higher than 7 millimoles per liter are associated with cardiac arrhythmias and an increased incidence of intraventricular hemorrhage and periventricular leukomalacia.,this drug,0
191008d5-0b5d-4ffb-8048-e802cf34f0e8,Pain was reduced in severity by day 29 and completely resolved once tacrolimus was discontinued on day 42.,0,Pain was reduced in severity by day 29 and completely resolved once tacrolimus was discontinued on day 42.,this drug,1
23e9a164-6728-4d2c-8c06-4caa34f3ca58,There was no recurrence of thrombosis or bleeding events during therapy with danaparoid.,0,There was no recurrence of thrombosis or bleeding events during therapy with danaparoid.,this drug,0
c58e3815-3cc3-4f1d-9aca-34cbfcde7511,"The present report suggests that clarithromycin coadministration induces increased plasma carbamazepine concentrations, which may result in carbamazepine toxicity.",1,"The present report suggests that clarithromycin coadministration induces increased plasma carbamazepine concentrations, which may result in carbamazepine toxicity.",this drug,1
ec3363a1-cd5e-4b03-a842-5ff033d3993a,"A 54-year-old woman with recurrent adenocarcinoma of the uterus was treated with new third-generation cephalosporin, cefmenoxime, for a urinary tract infection.",0,"A 54-year-old woman with recurrent adenocarcinoma of the uterus was treated with new third-generation cephalosporin, cefmenoxime, for a urinary tract infection.",this drug,0
756e6c45-8cd2-4d6f-ae0d-81de2cdb59f1,"Delusional disorder, somatic type treated with aripiprazole--mirtazapine combination.",0,"Delusional disorder, somatic type treated with aripiprazole-mirtazapine combination.",this drug,0
0f016958-0ded-4bd0-bf15-06e9a67a487c,"A stage Va B-cell multicentric lymphoma was diagnosed on clinical, cytological (lymph node, bone marrow), histological-immunohistochemical (lymph node excision) and imaging grounds.",0,"A stage IV B-cell multicentric lymphoma was diagnosed on clinical, cytological (lymph node, bone marrow), histological-immunohistochemical (lymph node excision) and imaging grounds.",this drug,1
a236b589-4788-4d32-8650-f7ed33e26f18,"Here we describe a clinical case in which time to diagnosis from the onset of peptic symptoms was delayed more than 10 years, in part reflecting symptom masking by continuous prescription of the PPI omeprazole.",0,"Here we describe a clinical case in which time to diagnosis from the onset of peptic symptoms was delayed more than 10 years, in part reflecting symptom masking by continuous prescription of the proton pump inhibitor omeprazole.",this drug,0
c6d723ac-ac1b-407f-ac8d-d96c6fdb4b4a,Monitoring of liver function tests should be mandatory in patients receiving high doses of cyproterone acetate; the drug should be withdrawn immediately if abnormal liver function tests are found.,1,Monitoring of liver function tests should be mandatory in patients receiving high doses of cyproterone acetate; the drug should be withdrawn immediately if abnormal liver function tests are found.,this drug,1
0148719a-e38b-46d2-891b-77dfbada3854,"Laboratory evaluations disclosed normal electrolytes, hemograms and non-toxic serum MTX levels at the onset of the symptoms.",0,"Laboratory evaluations disclosed normal electrolytes, hemograms, and non-toxic serum methotrexate levels at the onset of the symptoms.",this drug,0
08040506-f2c4-42ad-910f-085851df57f5,"Adalimumab, a fully human, immunoglobulin G1 monoclonal antibody that binds to tumor necrosis factor, has been approved for the treatment of moderate-to-severe psoriasis, in the U.S., Europe and elsewhere.",0,"Adalimumab, a fully human, immunoglobulin G1 monoclonal antibody that binds to tumor necrosis factor, has been approved for the treatment of moderate-to-severe psoriasis, in the U.S., Europe and elsewhere.",this drug,0
47c6306c-ba72-4b65-b602-5b1009974d93,The acute reaction to nitrofurantoin is believed to be mediated by an immune mechanism.,0,The acute reaction to nitrofurantoin is believed to be mediated by an immune mechanism.,this drug,0
c79389e1-cc35-4b6d-a833-3419a94271e9,Recent efforts have focused on heightened surveillance to detect contamination before transfusion to limit recipient morbidity and mortality.,0,Recent efforts have focused on heightened surveillance to detect contamination before transfusion to limit recipient morbidity and mortality.,this drug,0
e5a0015f-9b1c-469c-9e6b-d4e15ae65408,We describe a case of hyperchloraemic metabolic acidosis with hypoaldosteronism in a 4-year-old boy with nephrotic syndrome who was receiving ACE inhibitors.,0,We describe a case of hyperchloremic metabolic acidosis with hypoaldosteronism in a 4-year-old boy with nephrotic syndrome who was receiving Angiotensin Converting Enzyme inhibitors.,this drug,0
95681744-c8b3-4434-b268-121bcdab011c,OBJECTIVE: Traditional monoamine oxidase inhibitors (MAOIs) continue to play an important role in the management of a wide variety of clinical conditions.,0,OBJECTIVE: Traditional monoamine oxidase inhibitors (Angiotensin Converting Enzyme inhibitors) continue to play an important role in the management of a wide variety of clinical conditions.,this drug,0
33d6646e-7dde-4782-82ae-ca2d3ff4eaa7,Acute septic arthritis in chronic osteonecrosis of the hip.,0,Acute septic arthritis in chronic osteonecrosis of the hip.,this drug,0
2507741c-1dcb-40a9-bf74-50b03cbe6a61,Various features are often seen during the course of the disease.,0,Various features are often seen during the course of the disease.,this drug,0
80cd996f-2667-4e61-9c25-c2b514ba72a3,RESULTS: A 44-year-old man taking naproxen for chronic low back pain and a 20-year-old woman on oxaprozin for rheumatoid arthritis presented with tense bullae and cutaneous fragility on the face and the back of the hands.,1,RESULTS: A 44-year-old man taking naproxen for chronic low back pain and a 20-year-old woman on oxaprozin for rheumatoid arthritis presented with tense bullae and cutaneous fragility on the face and the back of the hands.,this drug,1
98b71e22-22ba-46ed-b725-0c5063172f6b,Propylthiouracil-induced sensorineural hearing loss associated with antineutrophil cytoplasmic antibodies.,1,Propylthiouracil-induced sensorineural hearing loss associated with antineutrophil cytoplasmic antibodies.,this drug,1
0bc60b27-48c9-4a4c-bde4-3904076957a7,"We describe a 25-year-old, human immunodeficiency virus (HIV)--negative man, who was started on antituberculosis treatment (ATT) with isoniazid (H), rifampicin (R), pyrazinamide (Z) and ethambutol (E) in the combination RHZE for the first two months and RH there on.",0,"We describe a 25-year-old, human immunodeficiency virus (HIV)--negative man, who was started on antituberculosis treatment (ATT) with isoniazid (H), rifampicin (R), pyrazinamide (Z), and ethambutol (E) in the combination RHZE for the first two months and then on RH.",this drug,0
da694fe7-c3ba-4b4a-9450-1bddd5a8b1d2,"Thus, the effect of antidiabetic agents on cardiovascular health and safety must be considered when selecting the most appropriate therapy.",0,"Thus, the effect of antidiabetic medications on cardiovascular health and safety must be considered when selecting the most appropriate therapy.",this drug,0
fd32cd01-7405-4bbc-92b0-80f8f1cbc30a,"Examination revealed a very ill looking pale patient with abdominal distension, tenderness and rectal bleeding and easy bruisability.",0,"Examination revealed a very ill-looking patient with pallor, abdominal distension, tenderness, rectal bleeding, and ecchymosis.",this drug,1
c373bec3-89f5-49a9-82ea-a12217a406c9,The liver abscess had resolved almost completely on ultrasonography after 2 weeks of therapy.,0,The liver abscess had resolved almost completely on ultrasonography after 2 weeks of therapy.,this drug,0
