id,text,label,normalized_text,meta_doc_drugs,final_pred
75146419-59f0-4943-8d94-5e4de841c33a,The patient was intubated with ventilator support and improved after his metabolic acidosis resolved.,0,The patient was intubated with ventilator support and improved after his metabolic acidosis resolved.,this drug,0
bba0d8f1-29fb-4487-9569-c0aa9d701ac8,"Subjective complaints decreased, and best-corrected Snellen visual acuity improved with topical corticosteroid therapy alone.",0,"Subjective complaints decreased, and best-corrected Snellen visual acuity improved with topical corticosteroid therapy alone.",this drug,0
692275a3-5d27-42bc-a600-5f3eaec63f8b,CONCLUSIONS: We have seen an increased incidence of acute INH neurotoxicity because of the resurgence of TB in New York City.,1,CONCLUSIONS: We have seen an increased incidence of acute Isoniazid neurotoxicity because of the resurgence of Tuberculosis in New York City.,this drug,1
fcfbd73a-ce0f-432b-a0e0-952e397f4cfe,"48 h after interrupting treatment, she recovered normal neurological status and 500 mg of valacyclovir every 2 days was effective and well tolerated.",0,"48 h after interrupting treatment, she recovered normal neurological status and 500 mg of valacyclovir every 2 days was effective and well tolerated.",this drug,0
5f741587-9733-460c-ae03-e0c4e7377be0,Magnetic resonance imaging (MRI) showed superior sagittal sinus (SSS) thrombosis and meningeal enhancement.,0,Magnetic resonance imaging (MRI) showed superior sagittal sinus (SSS) thrombosis and meningeal enhancement.,this drug,1
7165439d-22c9-4e6e-a212-1da13e2eee78,"Although the symptom complex of disseminated cysticercosis has been well recognized for over half a century, it is not clearly included in recent disease classifications.",0,"Although the symptom complex of disseminated neurocysticercosis has been well recognized for over half a century, it is not clearly included in recent disease classifications.",this drug,0
d01885ef-10d7-4073-b8ca-127d906a9147,"On postoperative day 17, she demonstrated hyperkalaemia and metabolic acidosis; she was diagnosed to have hyperkalaemic distal RTA with aldosterone deficiency (type IV).",0,"On postoperative day 17, she demonstrated hyperkalemia and metabolic acidosis; she was diagnosed to have hyperkalemic distal renal tubular acidosis with aldosterone deficiency (type IV).",this drug,1
ed1a4311-214e-46d6-86d6-f4dde20794af,"Here, we will describe three episodes of NMS that fulfilled the DSM-IV criteria for NMS (APA, 1994).",0,"Here we will describe three episodes of neuroleptic malignant syndrome that fulfilled the Diagnostic and Statistical Manual of Mental Disorders, Fourth Edition criteria for neuroleptic malignant syndrome (American Psychiatric Association, 1994).",this drug,1
274f70ff-e89f-4363-a93c-e538ed17e5e6,Development of porphyria cutanea tarda after treatment with cyclophosphamide.,1,Development of porphyria cutanea tarda after treatment with cyclophosphamide.,this drug,1
3d6dfbc9-63c8-464a-a751-8210ae45f1e6,Investigations confirmed a leucopenia and neutropenia.,0,Investigations confirmed a leukopenia and neutropenia.,this drug,1
b6c9fb38-6d5d-428a-b3ce-918abfc63549,"PURPOSE: Eosinophilic jejunitis is a rare disorder of undetermined origin, which is characterized by infiltration of eosinophils in the intestine.",0,"PURPOSE: Eosinophilic jejunitis is a rare disorder of undetermined origin, which is characterized by infiltration of eosinophils in the intestine.",this drug,0
dd59b186-7ff9-4769-bc34-b2b562caa722,"Administration of high-dose intrathecal methotrexate may not lead to symptoms, as was the case in our patient.",0,"Administration of high-dose intrathecal methotrexate may not lead to symptoms, as was the case in our patient.",this drug,0
0970c6bc-a7d3-4009-9a4d-bac0ec85b64a,"The glial abnormality, the most striking feature in the present case, strongly suggests toxic and metabolic disturbances.",0,"The glial abnormality, the most striking feature in the present case, strongly suggests toxic and metabolic disturbances.",this drug,1
465c6654-3c6f-4eba-b37b-eb4071a090e3,Death from inappropriate therapy for Lyme disease.,0,Death from inappropriate therapy for Lyme disease.,this drug,1
c9eb7b4d-50df-4fc7-ae3b-b3ebec95efc7,A complication of the implantable constant infusion chemotherapy pump.,0,A complication of the implantable continuous infusion chemotherapy pump.,this drug,0
92afd640-5381-4e34-abe0-4f1f350ac0cb,"Following the improvement of the symptoms of SJS, he received alternate-day oral prednisolone without any cutaneous eruption.",0,"Following the improvement of the symptoms of Stevens-Johnson syndrome, he received alternate-day oral prednisolone without any cutaneous eruption.",this drug,0
4e8a8d06-ae81-4e4e-bea7-74c1e2666cfb,The second is a 29-year-old man with CD in whom nodular sclerosing Hodgkin's lymphoma was diagnosed 3 weeks after infusion with infliximab.,1,The second is a 29-year-old man with CD4+ in whom nodular sclerosing classical Hodgkin lymphoma was diagnosed 3 weeks after infusion with infliximab.,this drug,0
31461717-e504-454a-b965-ee1b2a338b2f,Follow-up of these infants has shown no recurrence of seizures.,0,Follow-up of these infants has shown no recurrence of seizures.,this drug,0
3f64e2a9-365b-44d7-9ebb-c9468cdd25c5,There was prompt response of oral ketoconazole.,0,There was prompt response of oral ketoconazole.,this drug,0
ac146f89-fd8e-4afe-9cfc-7bf32f263194,"Torsades de Pointes induced by a combination of garenoxacin and disopyramide and other cytochrome P450, family 3, subfamily A polypeptide-4-influencing drugs during hypokalemia due to licorice.",1,"Torsades de Pointes induced by a combination of garenoxacin and disopyramide and other cytochrome P450, family 3, subfamily A polypeptide-4-influencing drugs during hypokalemia due to licorice.",this drug,0
99c93eef-9a1d-4b26-bde7-c087edc72790,In vitro lymphocyte transformation studies confirmed cross-reactivity to one or more aromatic AEDs in 3 patients.,0,In vitro lymphocyte transformation studies confirmed cross-reactivity to one or more aromatic antiepileptic drugs in 3 patients.,this drug,0
752ba624-b7e8-498b-8233-7a3fa6d7fcbf,Severe diffuse interstitial pneumonitis induced by carmustine (BCNU).,1,Severe diffuse interstitial pneumonitis induced by carmustine (BCNU).,this drug,1
8835b14e-387a-486a-a003-9dc2ab1d7249,Venlafaxine was chosen (daily dose 75 mg) because this drug is claimed not to bind on muscarinic cholinergic receptors.,0,Venlafaxine was chosen (daily dose 75 mg) because this drug is claimed not to bind to muscarinic cholinergic receptors.,this drug,0
97fa3ab5-d00a-44ba-9569-d57a80a04b4c,"Polyarthritis, hepatitis and anti-native DNA antibodies after treatment with ethambutol and rifampicin.",1,"Polyarthritis, hepatitis, and antinuclear antibody positivity after treatment with ethambutol and rifampicin.",this drug,1
dc375121-06f4-46bb-b34a-6b96bc5596a1,The bilateral ptosis markedly improved after 7 days of pyridoxine and pyridostigmine treatment and completely resolved after two weeks.,0,The bilateral ptosis markedly improved after 7 days of pyridoxine and pyridostigmine treatment and completely resolved after two weeks.,this drug,0
2a3a96dd-e077-4af3-9fed-40619057c13b,Herein we document the unusual association of focal nodular hyperplasia with use of a synthetic anabolic androgen.,0,Herein we document the unusual association of focal nodular hyperplasia with use of a synthetic anabolic androgen.,this drug,0
cfe2141f-46c4-497d-9c04-962a456a7274,The increase of tumor volume at the beginning of therapy does not require the suspension of treatment.,0,The increase of tumor volume at the beginning of therapy does not require the suspension of treatment.,this drug,0
f3860610-70e3-4e21-adf1-6d4e42718280,His inhibitor titres ranged from 10 to 3450 Bethesda units (BU).,0,His inhibitor titres ranged from 10 to 3450 Bethesda units (BU).,this drug,0
b39c036f-2065-48dc-939e-bb194c095d03,"Previous studies have demonstrated the interaction of MTX and a variety of non-steroidal, anti-inflammatory drugs (NSAIDs) with various clinical manifestations including acute renal failure, pancytopenia, vomiting, diarrhea, elevated liver transaminases, jaundice, mucosal ulcerations, and pyrexia.",1,"Previous studies have demonstrated the interaction of methotrexate and a variety of non-steroidal, anti-inflammatory drugs (NSAIDs) with various clinical manifestations including acute renal failure, pancytopenia, vomiting, diarrhea, elevated liver transaminases, jaundice, mucosal ulcerations, and pyrexia.",this drug,1
f194f858-6760-4bf6-84eb-8ee7f51f389d,One patient presented twice with seizures.,0,One patient presented twice with seizures.,this drug,1
07a42ba0-0262-4816-bf56-b58a9eefe36c,Case report.,0,Case report.,this drug,0
31c29f94-3f19-4551-a36c-996ffc272d10,Persistent right umbilical vein--case report and review of literature.,0,Persistent right umbilical vein--case report and review of literature.,this drug,0
7c15b600-f4ed-4f8f-bc65-cd49e7c34a17,Pulmonary hypertension during lithium therapy: clinical case study.,1,Pulmonary hypertension during lithium therapy: clinical case study.,this drug,1
80fe9a85-0e56-44e6-bbeb-ba3d54590367,Life threatening laryngeal toxicity following treatment with combined chemoradiotherapy for nasopharyngeal cancer: a case report with review of the literature.,0,Life-threatening laryngeal toxicity following treatment with combined chemoradiotherapy for nasopharyngeal cancer: a case report with review of the literature.,this drug,1
1cd650b9-91a6-4141-bf9b-335d06ad6543,The current case should alert clinicians to investigate pulmonary GVHD as a potential cause of postoperative dyspnea in liver transplant recipients.,0,"The current case should alert clinicians to investigate graft-versus-host disease, pulmonary as a potential cause of postoperative dyspnea in liver transplant recipients.",this drug,0
05a1165c-f0d3-4d8d-a24a-4e26d201e1b3,This case suggests that disopyramide should be used with caution in patients with bifascicular block patterns on ECG.,0,This case suggests that disopyramide should be used with caution in patients with bifascicular block patterns on electrocardiogram.,this drug,0
977d3908-b253-4b2b-a58f-54a3ffad8d64,We here report on two patients who received imatinib in the presence of increased bilirubin and/or cholestasis parameters.,0,We report on two patients who received imatinib in the presence of elevated bilirubin levels and/or cholestasis parameters.,this drug,0
5eacc666-30ca-41fb-951c-c99ea451010d,Three patients developed proteinuria following gold therapy for rheumatoid arthritis.,1,Three patients developed proteinuria following gold therapy for rheumatoid arthritis.,this drug,1
0e4bdb2b-6a4b-42cc-9a7c-b72eb57e2f1c,"Its mode of anti-inflammatory actions in rheumatoid arthritis is not clearly understood, but modulation of neutrophil activity or inhibition of neutrophil inflammatory product formation or release appear to play a role.",0,"Its mode of anti-inflammatory actions in rheumatoid arthritis is not clearly understood, but modulation of neutrophil activity or inhibition of neutrophil inflammatory product formation or release appear to play a role.",this drug,0
2a71538f-2213-4fca-944a-2923c7252d95,"Liver biopsy showed intralobular inflammatory infiltrates, confluent necrosis and apoptosis, compatible with drug-induced liver disease.",0,"Liver biopsy showed intralobular inflammatory infiltrates, confluent necrosis and apoptosis, compatible with drug-induced liver disease.",this drug,1
878ad687-24fc-4a04-989b-ed8da413dc52,"Histopathological findings included signs of orthokeratotic hyperkeratosis, moderate follicular keratosis and light epidermic acanthosis.",0,"Histopathological findings included signs of orthokeratotic hyperkeratosis, moderate follicular keratosis and light epidermic acanthosis.",this drug,1
2e6eaecb-877e-46a4-86e2-6e96c974810d,"We conclude, this novel mode of intra-operative local chemotherapy by spray application of fibrin glue containing antineoplastic agent is effective in the control of residual tumor progression and may also prevent local recurrence and hence suggests its possible role as an adjuvant therapy in the management of malignant gliomas.",0,"We conclude, this novel mode of intra-operative local chemotherapy by spray application of fibrin glue containing antineoplastic agent is effective in the control of residual tumor progression and may also prevent local recurrence and hence suggests its possible role as an adjuvant therapy in the management of malignant gliomas.",this drug,0
6084cccf-95c8-4352-a10e-9fa4f10eb98a,The HIV protease inhibitor indinavir may cause nephrolithiasis and interstitial nephritis.,1,The HIV protease inhibitor indinavir may cause nephrolithiasis and interstitial nephritis.,this drug,1
db83d35d-4d08-4b52-9a9f-51ad6d48c2b2,Equine-derived antivenin was given in 14 cases (range 2-30 vials).,0,Equine-derived antivenom was given in 14 cases (range 2-30 vials).,this drug,0
7d0d7d39-a1a1-4dcb-b710-dc2e42620d35,OBJECTIVE: To report a case of neuroleptic malignant syndrome (NMS) associated with fluphenazine in a schizophrenic patient and review the literature related to this condition.,1,OBJECTIVE: To report a case of neuroleptic malignant syndrome (NMS) associated with fluphenazine in a schizophrenic patient and review the literature related to this condition.,this drug,1
bffe0d2d-18a8-4104-99dd-dfe682106f88,The present preliminary report suggests that pharmacokinetic factors cannot be excluded and the CYP2D6 polymorphism is possibly associated with the etiology of NMS.,0,The present preliminary report suggests that pharmacokinetic factors cannot be excluded and the cytochrome P450 2D6 polymorphism is possibly associated with the etiology of neuroleptic malignant syndrome.,this drug,0
8afbb709-a152-440f-beac-6665fa907658,It represents one of the few documented cases of delayed clearance of echovirus in the cerebrospinal fluid in a patient with normal serum immunoglobulins.,0,It represents one of the few documented cases of delayed clearance of echovirus in the cerebrospinal fluid in a patient with normal serum immunoglobulins.,this drug,0
0e563d64-669a-48af-84a6-0f8ac180f5e1,"Approximately 1 year after symptom onset he developed mild seropositive oculobulbar myasthenia gravis, which spontaneously remitted after 5 months.",0,"Approximately 1 year after symptom onset he developed mild seropositive oculobulbar myasthenia gravis, which spontaneously remitted after 5 months.",this drug,0
410ea542-cbbc-4caf-9d18-0bfbbcf461db,This toxic effect may be added to the list of potential adverse events occurring during ddI therapy.,0,This toxic effect may be added to the list of potential adverse events occurring during didanosine therapy.,this drug,0
4c254898-8286-45b9-93a4-4965f4289c33,"Here, we report the successful treatment of a colonic ulcer that had penetrated the urinary bladder.",0,"Here, we report the successful treatment of a colonic ulcer that had penetrated the urinary bladder.",this drug,0
7fed98f2-473e-4c0c-89ff-1f4177b243c1,"The infant developed repeated tongue thrust, abnormal hand posturing, and tremor of all extremities.",0,"The infant developed repeated tongue thrust, abnormal hand posturing, and tremor of all extremities.",this drug,1
660dab21-48cf-46d4-b927-1abc5ac9661c,"Eight cases of pellagra, diagnosed on the grounds of neuropathological findings and retrospective study of clinical data, were found among 106 necropsy cases of tuberculosis.",0,"Eight cases of pellagra, diagnosed on the grounds of neuropathological findings and retrospective study of clinical data, were found among 106 autopsy cases of tuberculosis.",this drug,0
df960611-ff3b-4456-bd47-15308d657453,Four of the aviators were allowed to continue on active duty with limitations and one was disqualified.,0,Four of the aviators were allowed to continue on active duty with limitations and one was disqualified.,this drug,0
f31cb80a-ef8d-490e-8c96-6e7d8b6c8939,"CASE SUMMARIES: While conducting a protocol evaluating the efficacy of intraperitoneal cisplatin and hyperthermia in the treatment of recurrent ovarian cancer, 3 patients were noted to exhibit anaphylactoid reactions.",1,"CASE SUMMARIES: While conducting a protocol evaluating the efficacy of intraperitoneal cisplatin and hyperthermia in the treatment of recurrent ovarian cancer, 3 patients were noted to exhibit anaphylactoid reactions.",this drug,1
93d1c275-c4c2-41c1-8e9d-bcf8c03d33b6,"Defects noted include tooth and root agenesis, root thinning and shortening, and localized enamel defects.",0,"Tooth and root agenesis, root thinning and shortening, and localized enamel defects.",this drug,1
2d552290-7e99-4562-aa85-976504f8a75d,The risk of developing NMS under atypical neuroleptics seems lower than under typical neuroleptics.,0,The risk of developing neuroleptic malignant syndrome under atypical neuroleptics appears to be lower than under typical neuroleptics.,this drug,0
4b712a79-4361-4321-890a-c78cc40550e0,"Although isradipine has been associated with hepatocellular injury, there are no reports of fulminant liver failure with this agent, and our patient had been treated for >2 years without signs of toxicity.",1,"Although isradipine has been associated with hepatocellular injury, there are no reports of fulminant liver failure with this agent, and our patient had been treated for >2 years without signs of toxicity.",this drug,0
cffce295-cb49-4368-af6c-21adc4d18d60,Malignant neoplasm after immunosuppressive therapy is a well-known entity.,0,Malignant neoplasm after immunosuppressive therapy is a well-known entity.,this drug,0
d6117400-c3a7-4f9f-9e5c-efcc93394054,"Later, he had no impulse disorders (no gambling, hypersexuality, excessive shopping), which occur with dopamine agonists, suggesting that levodopa abuse and impulse disorders can result through different mechanisms.",0,"Later, he had no impulse disorders (no gambling, hypersexuality, excessive shopping), which occur with dopamine agonists, suggesting that levodopa abuse and impulse disorders can result through different mechanisms.",this drug,0
2b81419c-7a4e-4990-9827-f2f9af5da02b,"Moreover, as the pathophysiology of this disorder becomes less of a hypothesis and more of an understood entity, it is likely that treatment options will broaden beyond the use of daily prophylactic colchicine.",0,"Moreover, as the pathophysiology of this disorder becomes less of a hypothesis and more of an understood entity, it is likely that treatment options will broaden beyond the use of daily prophylactic colchicine.",this drug,0
ad0bdfd4-7720-44de-911b-1cf245c6e3a8,All patients except two had new recurrences within the observation time.,0,All patients except two had new recurrences within the observation time.,this drug,0
57af9e64-4c1f-4117-859f-1359fede6ff0,"Sulfasalazine-induced lung disorder is an extremely rare entity which must be considered in all ulcerative colitis patients while on sulfasalazine therapy, despite the absence of pulmonary symptomatology.",1,"Sulfasalazine-induced lung disorder is an extremely rare entity which must be considered in all ulcerative colitis patients while on sulfasalazine therapy, despite the absence of pulmonary symptomatology.",this drug,1
03732a2b-401d-439f-95c7-4f4caa04febb,"Spinal nerve block by intrathecal phenol-glycerine infusion is commonly employed for relief of severe pain in terminal carcinomatosis and, frequently, a dramatic regional anesthetic effect is achieved.",0,"Spinal nerve block by intrathecal phenol-glycerine infusion is commonly employed for relief of severe pain in terminal carcinomatosis and, frequently, a dramatic regional anesthetic effect is achieved.",this drug,0
ff98a6ca-4126-4278-8840-9157ae010579,"When clonazepam was reduced and discontinued, these behaviors significantly decreased from 3.1% of intervals (95% confidence band = 1.6% to 4.6%) to 0.1% of intervals (95% confidence band = 0% to 0.1%).",0,"When clonazepam was reduced and discontinued, these behaviors significantly decreased from 3.1% of intervals (95% confidence band = 1.6% to 4.6%) to 0.1% of intervals (95% confidence band = 0% to 0.1%).",this drug,0
2f140c74-49fb-4123-ad6b-2df121949e16,"The patient was treated with methylprednisolone pulse therapy (1 g/day, for 3 days) followed by oral prednisolone.",0,"The patient was treated with methylprednisolone pulse therapy (1 g/day, for 3 days) followed by oral prednisolone.",this drug,0
7a8aab78-3dbc-4ef9-868c-f5ad167f01cd,One patient was a 21-day-old infant who received 2 days of induction chemotherapy for the treatment of congenital Stage IV-S neuroblastoma.,0,One patient was a 21-day-old infant who received 2 days of induction chemotherapy for the treatment of congenital stage IV S neuroblastoma.,this drug,0
8b8c2b93-1978-4409-aec7-3ed21e48c0ef,"The relevant literature is reviewed; a case history is presented; and implications for nursing care (e.g., early detection) are discussed.",0,"The relevant literature is reviewed; a case history is presented; and implications for nursing care (e.g., early detection) are discussed.",this drug,0
9de6b1a6-e473-4816-a656-3524900b1ad0,Ciprofloxacin-induced renal insufficiency in cystic fibrosis.,1,Ciprofloxacin-induced renal insufficiency in cystic fibrosis.,this drug,1
5b9ea12b-0b5b-44dd-84da-58b90f93094b,Acute pancreatitis is a rare but known complication of inflammatory bowel disease in adults.,0,Acute pancreatitis is a rare but known complication of inflammatory bowel disease in adults.,this drug,0
41de4c21-540a-4469-9694-32fce77c3414,Severe hemolytic uremic syndrome in an advanced ovarian cancer patient treated with carboplatin and gemcitabine.,1,Severe hemolytic uremic syndrome in an advanced ovarian cancer patient treated with carboplatin and gemcitabine.,this drug,1
8d26afcc-f846-425d-8d25-863ec82e7c2c,"Despite the risk of needle-track seeding, PEI remains useful in the treatment of HCC.",0,"Despite the risk of needle-track seeding, PEI remains useful in the treatment of hepatocellular carcinoma.",this drug,0
4413ec6b-a769-4570-b354-a230c2d7b44a,We present the first case of ovarian endometrioid carcinoma and endometriosis in a postmenopausal patient who was treated with tamoxifen for breast cancer.,1,We present the first case of ovarian endometrioid adenocarcinoma and endometriosis in a postmenopausal patient who was treated with tamoxifen for breast cancer.,this drug,0
57ac815a-7019-4a1e-90d1-ff413f9b7cf2,"However in some patients requiring emergency cardiac or vascular surgery, reexposure to heparin may be unavoidable.",0,"However in some patients requiring emergency cardiac or vascular surgery, reexposure to heparin may be unavoidable.",this drug,0
ed9341b3-b58a-4252-a754-05ef23bf81df,An antibiotic lock technique was created using a flush solution of vancomycin 1 mg/ml with 100 unit heparin/ml.,0,An antibiotic lock technique was created using a flush solution of vancomycin 1 mg/mL with 100 unit heparin/mL.,this drug,0
532cb729-87a3-4abc-a34d-71ac1a427d36,SETTING: A six-bed pediatric intensive care unit (ICU) at a university hospital.,0,SETTING: A six-bed pediatric intensive care unit (ICU) at a university hospital.,this drug,0
1fe2ceea-321a-48ee-91ea-7f8f2417067b,"Recognizing early signs of HMSN, such as areflexia and pes cavus deformity, can prevent severe neurotoxicity of polychemotherapy by avoiding vincristine.",1,"Recognizing early signs of Hereditary Motor and Sensory Neuropathy (HMSN), such as areflexia and pes cavus deformity, can prevent severe neurotoxicity of polychemotherapy by avoiding vincristine.",this drug,1
1cfd42c4-bffc-4c73-8dc3-95b735fa9a39,"We report for the first time the development of symptomatic methemoglobinemia after an acute ingestion of divalproex sodium (Depakote), resulting in serum concentrations 10 times greater than the therapeutic range.",1,"We report for the first time the development of symptomatic methemoglobinemia after an acute ingestion of valproate sodium, resulting in serum concentrations 10 times greater than the therapeutic range.",this drug,1
ad245967-0b34-44a0-ae6a-819ffddcfd63,"When questioned, he denied taking any other drugs including other alternative medicine approaches or vitamin supplements, particularly retinoids, well known for causing severe nail dystrophy.",0,"When questioned, he denied taking any other drugs, including other alternative medicine approaches or vitamin supplements, particularly Angiotensin-Converting Enzyme inhibitors, well known for causing severe nail dystrophy.",this drug,0
97d3ee1d-eef4-4d07-847d-5e0e30bf34df,"Imaging findings were compatible with left maxillary, ethmoidal, and sphenoidal sinusitis.",0,"Imaging findings were compatible with left maxillary, ethmoidal, and sphenoidal sinusitis.",this drug,0
2ce89aa5-07ea-4b56-af18-034b6300703b,"CONCLUSIONS: To avoid and protect themselves against potential abandonment allegations when termination of the physician-patient relationship is warranted, physicians are advised to consider following the outlined procedures.",0,"CONCLUSIONS: To avoid and protect themselves against potential abandonment allegations when termination of the physician-patient relationship is warranted, physicians are advised to consider following the outlined procedures.",this drug,0
3f11671c-6a91-4625-a701-61c63c8b9430,"She was treated with an intra-articular injection of 80 mg methylprednisolone into her sacroiliac joint, followed 2 days later by a cluster of herpetiform vesicles adjacent to the injection site.",0,"She was treated with an intra-articular injection of 80 mg methylprednisolone into her sacroiliac joint, followed 2 days later by a cluster of herpetiform vesicles adjacent to the injection site.",this drug,0
