id,text,label,normalized_text,meta_doc_drugs,final_pred
74010a03-c38d-44d1-ad38-d43a8bc50584,An 81-year-old female presented to her local emergency department (ED) with symptoms of bronchitis and was treated with nebulized bronchodilators.,0,An 81-year-old female presented to her local emergency department (ED) with symptoms of bronchitis and was treated with nebulized bronchodilators.,this drug,0
5754af54-c4cd-40b4-af32-e3d9edaad523,Renal biopsy showed acute interstitial nephritis with eosinophilic cells.,0,Renal biopsy showed acute interstitial nephritis with eosinophilic cells.,this drug,1
9ff63d3e-f739-4eb0-b884-f592a0e80547,"The patient's arthritis flared after the second infusion of infliximab, which was discontinued.",1,"The patient's rheumatoid arthritis flared after the second infusion of infliximab, which was discontinued.",this drug,0
8c38aa14-9587-421b-b34d-f955a6ac2c8a,A 65-year-old woman with bipolar disorder and complicated cardiovascular disease who was on maintenance lithium therapy developed a movement disorder following high doses of trazodone for treatment of an acute depression.,1,A 65-year-old woman with bipolar disorder and complicated cardiovascular disease who was on maintenance lithium therapy developed a movement disorder following high doses of trazodone for treatment of an acute depression.,this drug,1
c71682a8-9e6e-4750-bccb-06e3995e2108,Few have been described after liver transplantation.,0,Few have been described after liver transplantation.,this drug,0
5920cbfc-b2d8-4697-ab89-6a399c990f15,"Alternating sinus rhythm and intermittent sinoatrial (S-A) block was observed in a 57-year-old woman, under treatment for angina with 80 mg propranolol daily.",1,"Alternating sinus rhythm and intermittent sinoatrial (S-A) block was observed in a 57-year-old woman, under treatment for angina with 80 mg propranolol daily.",this drug,1
969fd7c6-7fdd-48a6-ac7a-745ef6541b2d,A 47-year-old woman began treatment with cloxacillin due to acute cellulitis.,0,A 47-year-old woman began treatment with cloxacillin due to acute cellulitis.,this drug,0
d9388864-c019-457c-a305-660f0555d49b,Prolonged enteroviral infection in a patient who developed pericarditis and heart failure after bone marrow transplantation.,0,Prolonged enteroviral infection in a patient who developed pericarditis and heart failure after bone marrow transplantation.,this drug,0
0a29a261-eb12-4e45-a411-c270f7e45fa2,"Later, she began treatment with mirtazapine.",0,"Later, she began treatment with mirtazapine.",this drug,0
cc52677d-80fc-42cf-923b-dd13c661bc73,"Surgical management of primary hyperhidrosis by upper dorsal sympathectomy is the treatment of choice for intractable hyperhidrosis, however, paradoxically it may be followed by troublesome compensatory hyperhidrosis in a significant number of patients.",0,"Surgical management of primary hyperhidrosis by upper dorsal sympathectomy is the treatment of choice for intractable hyperhidrosis, however, paradoxically it may be followed by troublesome compensatory hyperhidrosis in a significant number of patients.",this drug,0
a07710fc-c4cc-49af-95b4-7bdbb0510f4b,"Cutaneous rashes and eruptions can be caused by many medications, including carbamazepine.",1,"Cutaneous rashes and eruptions can be caused by many medications, including carbamazepine.",this drug,0
54a92cc0-f422-48cd-9700-1677c72004a4,INTRODUCTION: Visual loss is a rare complication of tuberculosis; it can be related to anti-tuberculous drugs or to the infection itself.,0,INTRODUCTION: Visual loss is a rare complication of tuberculosis; it can be related to anti-tuberculous medications or to the infection itself.,this drug,1
123c8489-2474-44cc-913d-71481e690417,Triazolam-induced nocturnal bingeing with amnesia.,1,Triazolam-induced nocturnal bingeing with amnesia.,this drug,1
c411e5e9-fc95-46aa-88a0-4dfa200ee6d0,FINDINGS: Six children with growth retardation noted after treatment with high-dose fluticasone propionate were found to have adrenal suppression.,1,FINDINGS: Six children with growth retardation noted after treatment with high-dose fluticasone propionate were found to have adrenal suppression.,this drug,1
60dc8e97-74bb-4819-bca6-f76f0c23acf2,In recent years there has been an increase in the use of ACE inhibitors in the paediatric population.,0,In recent years there has been an increase in the use of Angiotensin Converting Enzyme inhibitors in the paediatric population.,this drug,0
c44679c0-6de1-401b-b409-4459f2ed6eeb,"The major limiting side effect is hemolytic anemia, which may be mitigated through careful patient selection, conservative drug dosing, close monitoring, and possibly, concurrent administration of antioxidants or cytochrome P450 inhibitors.",0,"The major limiting side effect is hemolytic anemia, which may be mitigated through careful patient selection, conservative drug dosing, close monitoring, and possibly, concurrent administration of antioxidants or cytochrome P450 inhibitors.",this drug,0
d24d3b4f-54db-4b9c-b975-2842ae1d0836,One patient developed irreversible bilateral blindness and another unilateral blindness secondary to optic neuropathy.,0,One patient developed irreversible bilateral blindness and another unilateral blindness secondary to optic neuropathy.,this drug,1
5c419e07-fa04-4088-b540-b0cb06310ab4,OBJECTIVE: To report a case of cutaneous and hematologic toxicity in a patient treated with IL-2.,1,OBJECTIVE: To report a case of dermatological and haematological toxicity in a patient treated with Interleukin-2.,this drug,0
4e2b4e6b-d136-448b-84f7-133574c47fdb,Allergic contact angioedema to benzoyl peroxide.,1,Allergic contact angioedema to benzoyl peroxide.,this drug,1
62caa311-5cb0-4160-bd57-5e58e563e39e,Coronary thrombolysis with streptokinase or tissue plasminogen activator is useful for the treatment of acute myocardial infarction in selected patients.,0,Coronary thrombolysis with streptokinase or tissue plasminogen activator is useful for the treatment of acute myocardial infarction in selected patients.,this drug,0
e2cb40c6-2c3e-4903-90ef-56abf4348036,The ECG at the onset of CHB suggested block to have occurred in the trifascicular conduction system.,0,The ECG at the onset of chronic heart block suggested block to have occurred in the trifascicular conduction system.,this drug,0
530fc9a7-851c-4c31-ad14-15c33eaa51d9,Disseminated varicella infection is a potentially life-threatening complication of chronic high-dose corticosteroid (CS) or immunosuppressive therapy.,0,Disseminated varicella infection is a potentially life-threatening complication of chronic high-dose corticosteroid (CS) or immunosuppressive therapy.,this drug,1
dc88eb1a-a3cb-46e6-8e6e-e456161916bc,Lithium medication during pregnancy is uncommon and the problems of a neonate who has been exposed to lithium represents a rare situation in neonatology.,0,Lithium medication during pregnancy is uncommon and the problems of a neonate who has been exposed to lithium represents a rare situation in neonatology.,this drug,1
8b0defc2-c4d8-4722-958e-0c15c1559a2c,"Because his supply of amphetamine-dextroamphetamine was diminishing, he took only half (30 mg every morning) of his prescribed dosage from days 4-12 of varenicline therapy.",0,"Because his supply of amphetamine-dextroamphetamine was diminishing, he took only half (30 mg every morning) of his prescribed dosage from days 4-12 of varenicline therapy.",this drug,0
a744469c-68b9-41d9-8d35-c68c7ae20dba,The patient was extubated 1 week later.,0,The patient was extubated 1 week later.,this drug,0
18601e32-2222-472a-9bd4-fe8975ab03c3,Three patients (3 eyes) representing unresolved total hyphema for more than 5 days and uncontrolled high intraocular pressure received intracameral injections of 10 microgram of recombinant tPA.,0,Three patients (three eyes) representing unresolved total hyphaema for more than 5 days and uncontrolled high intraocular pressure received intracameral injections of 10 microgram of recombinant tissue Plasminogen Activator.,this drug,0
a69b29ed-0b57-4197-a88a-17a3e790a30c,Toxicity related to chloroquine treatment of resistant vivax malaria.,1,Toxicity related to chloroquine treatment of resistant Plasmodium vivax malaria.,this drug,1
0c7a79d5-05e7-42dd-abf5-f77171500ac7,"Both cases had classical symptoms of Youssef's syndrome, i.e. cyclic hematuria, absence of vaginal bleeding and complete urinary continence.",0,"Both cases had classical symptoms of Youssef's syndrome, i.e. cyclic hematuria, absence of vaginal bleeding and complete urinary continence.",this drug,0
62e64257-b83f-42c9-a38c-0b505b6e87d7,"The authors report five cases of tremor related to itraconazole therapy, which occurred within 1-12 months of initiating treatment and resolved gradually following itraconazole withdrawal.",1,"The authors report five cases of tremor related to itraconazole therapy, which occurred within 1-12 months of initiating treatment and resolved gradually following itraconazole withdrawal.",this drug,1
d40a8d65-24e0-4470-a857-227753945297,"Adult patients with transfusional hemosiderosis were given ascorbic acid and treated with the iron chelator, desferrioxamine B.",0,"Adult patients with transfusional hemosiderosis were given ascorbic acid and treated with the iron chelator, desferrioxamine B.",this drug,0
52ec8055-f69a-4917-8b53-facbbb68625a,One of the subjects who was using extemporaneous topical minoxidil had hypertension and arteriosclerotic disease and the other died of a myocardial infarction.,1,One of the subjects who was using topical minoxidil had hypertension and atherosclerotic disease and the other died of a myocardial infarction.,this drug,1
3b4beab2-6618-4135-8139-8dbe98e91b08,Clinicians should be aware of the possibility of psychotic symptoms with the use of this agent.,0,Clinicians should be aware of the possibility of psychotic symptoms with the use of this agent.,this drug,1
597f46bd-9604-4a38-8c87-ce1366ced944,"Furthermore, beneficial or harmful effects of steroids in eosinophilic jejunitis and its treatment details are discussed and reviewed.",0,"Furthermore, beneficial or harmful effects of steroids in eosinophilic jejunitis and its treatment details are discussed and reviewed.",this drug,0
4f3aaf83-2740-4924-976b-257b4cfd446d,"In chronic hepatitis B viral infection TNF-alpha is readily produced, and viral clearance is dependent on the amount bioavailable.",0,"In chronic hepatitis B viral infection, tumor necrosis factor-alpha is readily produced, and viral clearance is dependent on the amount bioavailable.",this drug,0
1b265287-7c60-414e-a2df-52ac17b757af,"Therefore, we concluded that this patient's pulmonary disease was caused by calcium stearate, an additive for an antihistaminic drug.",1,"Therefore, we concluded that this patient's pulmonary disease was caused by calcium stearate, an additive for an antihistaminic drug.",this drug,0
b4baa2cd-2dac-45ad-804e-6f1bc5c292fc,"Six months after the procedure, the patient had an elective angiogram, where we discovered a new severe occlusion distally to the former stent; a second PES was implanted.",0,"Six months after the procedure, the patient had an elective angiogram, where we discovered a new severe occlusion distal to the former stent; a second percutaneous transluminal coronary angioplasty with stenting was implanted.",this drug,0
ca44e965-2f16-4e87-b4b8-fa1958a7342c,Symptomatology resolved with diphenhydramine.,0,Symptomatology resolved with diphenhydramine.,this drug,0
c1014510-a1c4-4417-af3d-f5d7d3f69270,"When high dose leucovorin was not used, residual neurological damage is not unusual.",0,"When high-dose leucovorin was not used, residual neurological damage is not unusual.",this drug,0
b63820e9-982a-4f0e-a844-1b914dde47c5,Translocation (4;11)(p12;q23) with rearrangement of FRYL and MLL in therapy-related acute myeloid leukemia.,0,Translocation (4;11)(p12;q23) with rearrangement of FRYL and MLL in therapy-related acute myeloid leukemia.,this drug,1
70e2d729-4d02-4922-b3ac-e3ebd07936b0,Pancreatitis has been noted to be a complication in 2-16% of patients undergoing treatment with L-asparaginase for a variety of pediatric neoplasms.,1,Pancreatitis has been noted to be a complication in 2-16% of patients undergoing treatment with L-asparaginase for a variety of pediatric neoplasms.,this drug,1
7b7250ad-db45-4466-ad3f-7fbc0682cc1d,"Because of their self-limiting nature, the importance of avoiding unnecessary and potentially deleterious antithyroid treatment is emphasised.",0,"Because of their self-limiting nature, the importance of avoiding unnecessary and potentially deleterious antithyroid treatment is emphasised.",this drug,0
75e2c1fb-99e2-4515-b1f3-44e750ea7fde,Sequencing studies revealed the presence of mutations in viral isolates obtained after clinical resistance was observed.,0,Sequencing studies revealed the presence of mutations in viral isolates obtained after clinical resistance was observed.,this drug,0
e1e0517d-9e08-4fe2-bef1-e5f25b8114e2,"It can cause severe CNS depression, especially in very young children.",0,"It can cause severe central nervous system depression, especially in very young children.",this drug,1
1efc13a0-e6f3-4490-81d8-d8e1690927b1,Reteplase was administered with concomitant lepirudin.,0,Reteplase was administered with concomitant lepirudin.,this drug,0
12f7ad06-956d-44fd-9c85-093a17a1d3ce,The biochemistry of paracetamol hepatotoxicity is outlined and the increased susceptibility of alcoholic patients to the hepatotoxic effects of paracetamol is remarked upon.,1,The biochemistry of paracetamol hepatotoxicity is outlined and the increased susceptibility of alcoholic patients to the hepatotoxic effects of paracetamol is remarked upon.,this drug,0
6da81890-7ad7-4565-9505-406b8c7b786c,We present this report to alert physicians and pharmacists about the potential risk of the first-dose phenomenon even at the recommended initial doses of prazosin in hypertensive patients who have suffered a recent stroke.,0,We present this report to alert physicians and pharmacists about the potential risk of the first-dose phenomenon even at the recommended initial doses of prazosin in hypertensive patients who have suffered a recent stroke.,this drug,0
74d60a36-db01-434f-979d-20179b349aa7,Acute lung injury associated with 5-fluorouracil and oxaliplatinum combined chemotherapy.,1,Acute lung injury associated with 5-fluorouracil and oxaliplatin combined chemotherapy.,this drug,1
230853be-8792-4f03-aa13-f1d0aaaeb1ae,"Once her blood pressure stabilized, the patient improved clinically.",0,"Once her blood pressure stabilized, the patient improved clinically.",this drug,0
1bfeddb8-d0db-49e3-8c49-9d2f36bbadb5,"BACKGROUND: Methotrexate (MTX) may induce liver damage, which in some psoriatics will lead to fibrosis or cirrhosis.",1,"BACKGROUND: Methotrexate (MTX) may induce hepatic damage, which in some patients with psoriasis will lead to fibrosis or cirrhosis.",this drug,1
ee639c61-e7de-423e-b92c-67270b9c17d9,"Despite early complete paraplegia, some neurological and functional recovery was observed.",0,"Despite early complete paraplegia, some neurological and functional recovery was observed.",this drug,0
b7211578-8fdf-4d70-ae86-25c5160018f4,A kidney biopsy revealed that he had focal segmental glomerulosclerosis.,0,A kidney biopsy revealed that he had focal segmental glomerulosclerosis.,this drug,1
6f99261e-116c-4922-9558-3839de78d595,CONCLUSION: Ushaar latex is capable of penetrating the corneal stroma and inducing permanent loss of endothelial cells.,0,CONCLUSION: Ushaar latex is capable of penetrating the corneal stroma and inducing permanent loss of endothelial cells.,this drug,1
ed610bfb-f9d7-442c-8e41-f88a18252f0f,Hypogammaglobulinemia associated with gold therapy: evidence for a partial maturation blockade of B cells.,1,Hypogammaglobulinemia associated with gold therapy: evidence for a partial maturation blockade of B cells.,this drug,1
3c5613dd-47e8-4bec-9d6d-38e65a90f136,The patient died 5 months after MAHA was diagnosed.,0,The patient died 5 months after myocardial infarction with hemolytic anemia was diagnosed.,this drug,0
d82160b3-29c3-4a3f-aa55-94252643b8b1,There may be a synergistic effect when corticosteroids are used in combination with chemotherapy and radiation treatment.,0,There may be a synergistic effect when corticosteroids are used in combination with chemotherapy and radiation therapy.,this drug,0
d1b788b5-753f-4240-a13e-eb12020da8b8,Immediate surgical management became necessary.,0,Immediate surgical management became necessary.,this drug,0
071f4338-0e72-42eb-8eeb-ecae30125a9b,The 3 others developed clinical pericardial tamponade before surgery.,0,The 3 others developed clinical pericardial tamponade before surgery.,this drug,1
9a3f17a8-b6f9-4d6f-a02a-d748c13b4e1b,Two patients required emergent surgical procedures.,0,Two patients required emergent surgical procedures.,this drug,0
e4db152a-28e6-478b-a1db-6f116653f813,"A platelet autoantibody could not be detected by a radioactive platelet antiglobulin test, but autologous platelet survival data indicated a compensated thrombolytic state in the recovery period.",0,"A platelet autoantibody could not be detected by a radioactive platelet antiglobulin test, but autologous platelet survival data indicated a compensated thrombolytic state in the recovery period.",this drug,0
10662609-3a44-4ef6-885d-35468a7450d2,Cytomegalovirus (CMV) pneumonia in the setting of non-transplantation patients is a rarity.,0,Cytomegalovirus (CMV) pneumonia in the setting of non-transplantation patients is a rarity.,this drug,0
c124bfc0-f9e7-4965-8b91-73e9178b1df2,A MEDLINE search did not identify any citation describing the possibility of an interaction between the drugs.,0,A MEDLINE search did not identify any citation describing the possibility of an interaction between the drugs.,this drug,0
9ce4e344-9c81-4eef-b304-7514fa8db840,Subsequent serial electro- and echocardiograms were normal.,0,Subsequent serial electrocardiograms and echocardiograms were normal.,this drug,0
1baac282-0d7b-4682-aa77-d75e4e0af8ce,Discontinuation of simvastatin and cyclosporine resulted in resolution of rhabdomyolysis and normalization of renal function.,1,Discontinuation of simvastatin and cyclosporine resulted in resolution of rhabdomyolysis and normalization of renal function.,this drug,0
da7bf546-dbfa-40ac-8610-a55f2d20fc7c,Gastric-outlet obstruction induced by prostaglandin therapy in neonates.,0,Gastric-outlet obstruction induced by prostaglandin therapy in neonates.,this drug,1
2d9d5faa-0b3a-4ce0-915a-2737bc29a675,A 61-year-old male with a history of severe heparin-induced thrombocytopenia (HIT) type II after aorto-femoral bypass surgery presented to the emergency department within 8 hours of development of substernal chest pain radiating to the left arm.,0,A 61-year-old male with a history of severe heparin-induced thrombocytopenia type II after aorto-femoral bypass surgery presented to the emergency department within 8 hours of development of substernal chest pain radiating to the left arm.,this drug,0
2ba5b15e-67a9-4c9e-ab88-4372b920842c,"These adverse reactions probably depend on the dose, metabolism and excretion of the drug.",0,"These adverse reactions probably depend on the dose, metabolism, and excretion of the drug.",this drug,0
b2f94779-9ecb-4e7c-af42-f8642d96c4ee,"Further study to confirm this significant finding and to determine if the long term prognosis of BP can be altered by the drug, is required.",0,"Further study to confirm this significant finding and to determine if the long-term prognosis of hypertension can be altered by the medication, is required.",this drug,0
b650421e-06d2-4cc5-8959-0f41548da64b,Surgical evacuation of the laryngeal hematoma was not necessary.,0,Surgical evacuation of the laryngeal hematoma was not necessary.,this drug,0
bbc5668d-3115-4ec9-ba90-75dab58bda4d,"Between March and May 1996, the patient was admitted several times to a neurology clinic, where myasthenia gravis was diagnosed and treatment with pyridostigmine and cyclosporine was initiated.",0,"Between March and May 1996, the patient was admitted several times to a neurology clinic, where myasthenia gravis was diagnosed and treatment with pyridostigmine bromide and cyclosporine was initiated.",this drug,0
38ab2fa9-38d5-44ab-bd7d-dcae98bbb60e,This case demonstrates that TZDs may precipitate weight gain and pulmonary and peripheral edema in patients with stable heart failure.,0,This case demonstrates that thiazolidinediones may precipitate weight gain and pulmonary and peripheral edema in patients with stable heart failure.,this drug,1
410fc42d-fa14-4f0d-9a99-13b885b2e719,"The first case, a 16-year-old African American male with an absolute CD4+ cell count of 314 cells/mm(3), presented with an abrupt rise in serum creatinine leading to irreversible renal failure while on TDF-containing highly active antiretroviral therapy (HAART).",0,"The first case, a 16-year-old African American male with an absolute CD4+ cell count of 314 cells/mm³, presented with an abrupt rise in serum creatinine leading to irreversible renal failure while on tenofovir disoproxil fumarate-containing highly active antiretroviral therapy (HAART).",this drug,1
2af99f59-1aa3-4bfe-8f15-cae1e041eed3,"Eleven patients developed infection requiring hospitalization while taking leflunomide including: lower respiratory tract infections (3), cellulitis (2), disseminated herpes zoster (2), probable TB liver (1), abdominal sepsis (1), mycotic aneurysm (1) and gastroenteritis (1).",1,"Eleven patients developed infection requiring hospitalization while taking leflunomide including: lower respiratory tract infections (3), cellulitis (2), disseminated herpes zoster (2), probable TB liver (1), abdominal sepsis (1), mycotic aneurysm (1) and gastroenteritis (1).",this drug,1
7e4037ec-a165-44a2-9ecd-00db1c3b08a3,We report the successful treatment of heparin-induced thrombocytopenia and subsequent hemorrhagic complications postoperatively in a 2-year-old child with Danaparoid (orgaran).,1,We report the successful treatment of heparin-induced thrombocytopenia and subsequent hemorrhagic complications postoperatively in a 2-year-old child with danaparoid (orgaran).,this drug,0
c98636ae-b3e6-48ba-8edc-9ae9a9120b4e,"Although studies have shown a relationship between abnormal scapular motion and subacromial impingement, it has been unclear whether the altered scapular biomechanics represent a cause, or consequence, of impingement.",0,"Although studies have shown a relationship between abnormal scapular motion and subacromial impingement, it has been unclear whether the altered scapular biomechanics represent a cause, or consequence, of impingement.",this drug,0
cffccb5d-0d0c-493e-bea0-a7f36ed3b8c7,Reye syndrome and juvenile rheumatoid arthritis in Michigan.,0,Reye syndrome and juvenile idiopathic arthritis in Michigan.,this drug,0
8331f4d8-43c9-4b31-98df-cdd7734cc61e,OBJECTIVE: To report a fatal case of toxic epidermal necrolysis in a man who was treated with oral ofloxacin for epididymitis.,1,OBJECTIVE: To report a fatal case of toxic epidermal necrolysis in a man who was treated with oral ciprofloxacin for epididymitis.,this drug,0
66ab40b3-e9e8-44e1-8225-ae5bf25dd3c5,In this article the possibility of using the Minirin (desmopressin) in maxillofacial surgery in person with hemostatic disorders has been described.,0,"In this article, the possibility of using the Minirin (desmopressin) in maxillofacial surgery in an individual with haemostatic disorders has been described.",this drug,0
8bbd85cf-ab0d-4f22-9ca3-51d4c48b2d26,Interaction between antiepileptic and antiretroviral agents is an emergent problem caused by the increasing association of the two therapies.,0,Interaction between antiepileptic and antiretroviral agents is an emergent problem caused by the increasing association of the two therapies.,this drug,0
cd53f6c6-105e-4218-a15e-26dd4b4e829c,The optimal management of anthracycline extravasation remains unclear.,0,The optimal management of anthracycline extravasation remains unclear.,this drug,0
2af99f59-1aa3-4bfe-8f15-cae1e041eed3,"Eleven patients developed infection requiring hospitalization while taking leflunomide including: lower respiratory tract infections (3), cellulitis (2), disseminated herpes zoster (2), probable TB liver (1), abdominal sepsis (1), mycotic aneurysm (1) and gastroenteritis (1).",1,"Eleven patients developed infection requiring hospitalization while taking leflunomide including: lower respiratory tract infections (3), cellulitis (2), disseminated herpes zoster (2), probable TB liver (1), abdominal sepsis (1), mycotic aneurysm (1) and gastroenteritis (1).",this drug,1
54e8de98-3f83-486b-ac75-6c421cc42e5d,We describe the clinical course of these patients and their management aimed at maximizing the effectiveness of gold therapy.,0,We describe the clinical course of these patients and their management aimed at maximizing the effectiveness of gold therapy.,this drug,0
920846c7-8d37-4bb4-b945-e65f372bf965,"Furthermore, rechallenge with sertraline caused CK and myoglobin to again increase, which was reversed following a discontinuation of sertraline.",0,"Furthermore, rechallenge with sertraline caused creatine kinase and myoglobin to again increase, which was reversed following a discontinuation of sertraline.",this drug,0
c0b7c859-3ef9-4471-8530-c69037f5f125,A smear for acid-fast bacilli or a culture was positive in 73% of cases.,0,A smear for acid-fast bacilli or a culture was positive in 73% of cases.,this drug,0
220973c8-f61d-4f94-86fc-c96aeae8244a,Pulmonary infiltrates and skin pigmentation associated with sulfasalazine.,1,Pulmonary infiltrates and skin pigmentation associated with sulfasalazine.,this drug,1
